"","V1","page","province","region","position","district","votes","proclamation_date","name","party","has_nickname"
"1","*ADIONG, ABDULMALIK MAGANGCONG      MIKE                                LAKAS NUCD-UMDP            0                  No date of Proclamation","1/9","LANAO DEL SUR","ARMM","congressman","1ST DISTRICT"," 0",NA,"*ADIONG, ABDULMALIK MAGANGCONG",NA,NA
"2","ALONTO, ABDULGAFFUR MADKI ALANGADI DICK                                INDEPENDENT              34,743","1/9","LANAO DEL SUR","ARMM","congressman","1ST DISTRICT"," 34,743",NA,"ALONTO, ABDULGAFFUR MADKI ALANGADI DICK","",TRUE
"3","DIANALAN, JIAMIL MARUHOM           JIMMY                               NPC                      16,879","1/9","LANAO DEL SUR","ARMM","congressman","1ST DISTRICT"," 16,879",NA,"DIANALAN, JIAMIL MARUHOM","NPC",TRUE
"4","BATUA, ARKIA ALOZ-NUSKA            BERT                                NP                       2,891","1/9","LANAO DEL SUR","ARMM","congressman","1ST DISTRICT"," 2,891",NA,"BATUA, ARKIA ALOZ-NUSKA","NP",TRUE
"5","*BALINDONG, PANGALIAN MACAORAO      ALI                                 LAKAS NUCD-UMDP            0                  No date of Proclamation","1/9","LANAO DEL SUR","ARMM","congressman","2ND DISTRICT"," 0",NA,"*BALINDONG, PANGALIAN MACAORAO",NA,NA
"6","DIPATUAN, TAIB PALA MARANGIT       TANY                                LABAN (LDP)              23,258","1/9","LANAO DEL SUR","ARMM","congressman","2ND DISTRICT"," 23,258",NA,"DIPATUAN, TAIB PALA MARANGIT","LABAN (LDP)",TRUE
"7","LUCMAN, UNOTAN GURO                UNO                                 NPC                      10,280","1/9","LANAO DEL SUR","ARMM","congressman","2ND DISTRICT"," 10,280",NA,"LUCMAN, UNOTAN GURO","NPC",TRUE
"8","PALAWAN, SULTAN MAGDARA DIMAPENDEG MAG                                  LP                       650","1/9","LANAO DEL SUR","ARMM","congressman","2ND DISTRICT"," 650",NA,"PALAWAN, SULTAN MAGDARA DIMAPENDEG MAG","",TRUE
"9","MUTILAN, MAHID MIRA-ATO            MAHID                               NPC                      93,116   May 23,1995","1/9","LANAO DEL SUR","ARMM","governor",""," 93,116","May 23,1995","MUTILAN, MAHID MIRA-ATO","NPC",TRUE
"10","PANGARUNGAN, SAIDAMEN B.           SAIDI                               LAKAS NUCD-UMDP          56,168","1/9","LANAO DEL SUR","ARMM","governor",""," 56,168",NA,"PANGARUNGAN, SAIDAMEN B.","LAKAS NUCD-UMDP",TRUE
"11","PANGANDAMAN, NASSER CADIENTE       BOY                                 LAKAS NUCD-UMDP          48,311","1/9","LANAO DEL SUR","ARMM","governor",""," 48,311",NA,"PANGANDAMAN, NASSER CADIENTE","LAKAS NUCD-UMDP",TRUE
"12","DIMAPORO, SULTAN MOHAMMAD ALI      ALI                                 LAKAS NUCD-UMDP          23,895","1/9","LANAO DEL SUR","ARMM","governor",""," 23,895",NA,"DIMAPORO, SULTAN MOHAMMAD ALI","LAKAS NUCD-UMDP",TRUE
"13","ALAUYA ALIM, SAADUDDIN A.          ALIM                                INDEPENDENT              4,034","1/9","LANAO DEL SUR","ARMM","governor",""," 4,034",NA,"ALAUYA ALIM, SAADUDDIN A.","INDEPENDENT",TRUE
"14","PUMBAYA, ALIM KUNUG SINAB-SIDA     BAPAI SAMER                         INDEPENDENT              1,414","1/9","LANAO DEL SUR","ARMM","governor",""," 1,414",NA,"PUMBAYA, ALIM KUNUG SINAB-SIDA","INDEPENDENT",TRUE
"15","YAHYA, HADJI YUSOPH B.             SHIEK                               INDEPENDENT               415","1/9","LANAO DEL SUR","ARMM","governor",""," 415",NA,"YAHYA, HADJI YUSOPH B.","INDEPENDENT",TRUE
"16","LUCMAN, NORMALA ALONTO ACASUM      KINKY                               LAKAS NUCD-UMDP         100,895   May 23,1995","1/9","LANAO DEL SUR","ARMM","vice governor",""," 100,895","May 23,1995","LUCMAN, NORMALA ALONTO ACASUM","LAKAS NUCD-UMDP",TRUE
"17","UMPAR, OMAR BERTUD                 PILANDOK 31                         OMPIA                    44,854","1/9","LANAO DEL SUR","ARMM","vice governor",""," 31",NA,"UMPAR, OMAR BERTUD","OMPIA",TRUE
"18","MINDALANO, SULTAN ALI ALI          BEBOT                               PDP-LABAN                16,793","1/9","LANAO DEL SUR","ARMM","vice governor",""," 16,793",NA,"MINDALANO, SULTAN ALI ALI","PDP-LABAN",TRUE
"19","YAHYA, JAMIL D.                    MOTAWA                              INDEPENDENT              14,031","1/9","LANAO DEL SUR","ARMM","vice governor",""," 14,031",NA,"YAHYA, JAMIL D.","INDEPENDENT",TRUE
"20","MAPUPUNO, KHALIL OGA MANGARUN      AL-AMIN                             LAKAS NUCD-UMDP          11,219","1/9","LANAO DEL SUR","ARMM","vice governor",""," 11,219",NA,"MAPUPUNO, KHALIL OGA MANGARUN","LAKAS NUCD-UMDP",TRUE
"21","PANDAPATAN, JAMIL MARABUR          PANDAPAT                            LAKAS NUCD-UMDP          55,793   May 23,1995","1/9","LANAO DEL SUR","ARMM","board member","1ST DISTRICT"," 55,793","May 23,1995","PANDAPATAN, JAMIL MARABUR","LAKAS NUCD-UMDP",TRUE
"22","BUBONG, MINOMA PANGADAPUN          HADJI MALIK                         LAKAS NUCD-UMDP          41,310   May 23,1995","1/9","LANAO DEL SUR","ARMM","board member","1ST DISTRICT"," 41,310","May 23,1995","BUBONG, MINOMA PANGADAPUN","LAKAS NUCD-UMDP",TRUE
"23","TAGO, PAISALIN PANGANDAMAN         POPOY                               LAKAS NUCD-UMDP          39,720   May 23,1995","1/9","LANAO DEL SUR","ARMM","board member","1ST DISTRICT"," 39,720","May 23,1995","TAGO, PAISALIN PANGANDAMAN","LAKAS NUCD-UMDP",TRUE
"24","TOMAWIS, SHIEK HARON PANGO-ALIP             HARON                               LAKAS NUCD-UMDP          29,033","2/9","LANAO DEL SUR","ARMM","board member","1ST DISTRICT"," 29,033",NA,"TOMAWIS, SHIEK HARON PANGO-ALIP","LAKAS NUCD-UMDP",TRUE
"25","DIAMLA, MUSAH ABDULGAFFAR KHADJIDIA SULTAN  HUSTANG                             INDEPENDENT              25,494","2/9","LANAO DEL SUR","ARMM","board member","1ST DISTRICT"," 25,494",NA,"DIAMLA, MUSAH ABDULGAFFAR KHADJIDIA SULTAN  HUSTANG","",TRUE
"26","BAYABAO, ACAS TALA                          CASS                                LAKAS NUCD-UMDP          24,033","2/9","LANAO DEL SUR","ARMM","board member","1ST DISTRICT"," 24,033",NA,"BAYABAO, ACAS TALA","LAKAS NUCD-UMDP",TRUE
"27","GURO, SULTAN MONCADO BOROA                  BOROWA                              LAKAS NUCD-UMDP          20,470","2/9","LANAO DEL SUR","ARMM","board member","1ST DISTRICT"," 20,470",NA,"GURO, SULTAN MONCADO BOROA","LAKAS NUCD-UMDP",TRUE
"28","MIMBALAWAG, ALEM MANSAWI MARUHOM            DARIDAY                             INDEPENDENT              20,122","2/9","LANAO DEL SUR","ARMM","board member","1ST DISTRICT"," 20,122",NA,"MIMBALAWAG, ALEM MANSAWI MARUHOM","INDEPENDENT",TRUE
"29","LOMONDOT, ABDULAZIZ MAMALAMPAC              ABET                                LAKAS NUCD-UMDP          19,161","2/9","LANAO DEL SUR","ARMM","board member","1ST DISTRICT"," 19,161",NA,"LOMONDOT, ABDULAZIZ MAMALAMPAC","LAKAS NUCD-UMDP",TRUE
"30","SHARIIF, FAROUK R. -                        -                                   LAKAS NUCD-UMDP          18,783","2/9","LANAO DEL SUR","ARMM","board member","1ST DISTRICT"," 18,783",NA,"SHARIIF, FAROUK R. -","",TRUE
"31","SULTAN, HASSAN MACARADI                     ALEEM                               LAKAS NUCD-UMDP          15,152","2/9","LANAO DEL SUR","ARMM","board member","1ST DISTRICT"," 15,152",NA,"SULTAN, HASSAN MACARADI","LAKAS NUCD-UMDP",TRUE
"32","MAGUINDANAO-MARANTAO, SALIC BANTO           MARANTAO                            LAKAS NUCD-UMDP          14,747","2/9","LANAO DEL SUR","ARMM","board member","1ST DISTRICT"," 14,747",NA,"MAGUINDANAO-MARANTAO, SALIC BANTO","LAKAS NUCD-UMDP",TRUE
"33","LUCMAN, PALAWAN JR. SAID                    JHUN PSL                            INDEPENDENT              13,941","2/9","LANAO DEL SUR","ARMM","board member","1ST DISTRICT"," 13,941",NA,"LUCMAN, PALAWAN JR. SAID","INDEPENDENT",TRUE
"34","MANGCA, SALAMAN DALAO                       SALLY                               INDEPENDENT              12,949","2/9","LANAO DEL SUR","ARMM","board member","1ST DISTRICT"," 12,949",NA,"MANGCA, SALAMAN DALAO","INDEPENDENT",TRUE
"35","ABINAL, H.GAFFAR BERUA PANSOM               LEGAWAN                             LAKAS NUCD-UMDP          12,900","2/9","LANAO DEL SUR","ARMM","board member","1ST DISTRICT"," 12,900",NA,"ABINAL, H.GAFFAR BERUA PANSOM","LAKAS NUCD-UMDP",TRUE
"36","MAURAC, SULTAN MADKI DIDA-AGEN              BACOLOD                             LAKAS NUCD-UMDP          11,143","2/9","LANAO DEL SUR","ARMM","board member","1ST DISTRICT"," 11,143",NA,"MAURAC, SULTAN MADKI DIDA-AGEN","LAKAS NUCD-UMDP",TRUE
"37","DEROGONGUN, DOMAWAL PAGADELAN               NAVAL                               LAKAS NUCD-UMDP          11,095","2/9","LANAO DEL SUR","ARMM","board member","1ST DISTRICT"," 11,095",NA,"DEROGONGUN, DOMAWAL PAGADELAN","LAKAS NUCD-UMDP",TRUE
"38","NOOR, ABDULGAFFUR PUNO GANI                 PUNO                                INDEPENDENT              10,852","2/9","LANAO DEL SUR","ARMM","board member","1ST DISTRICT"," 10,852",NA,"NOOR, ABDULGAFFUR PUNO GANI","INDEPENDENT",TRUE
"39","UMPAR, SULTAN ESMAYATIN BATUA-AN            TONY                                LAKAS NUCD-UMDP          10,794","2/9","LANAO DEL SUR","ARMM","board member","1ST DISTRICT"," 10,794",NA,"UMPAR, SULTAN ESMAYATIN BATUA-AN","LAKAS NUCD-UMDP",TRUE
"40","MAPANDI, HALIL NANGADAPUAN                  KAI                                 INDEPENDENT              9,786","2/9","LANAO DEL SUR","ARMM","board member","1ST DISTRICT"," 9,786",NA,"MAPANDI, HALIL NANGADAPUAN","INDEPENDENT",TRUE
"41","GURO, ABDUL MANAN MINUPUN BARAGONA          AL-MANAN                            NPC                      9,688","2/9","LANAO DEL SUR","ARMM","board member","1ST DISTRICT"," 9,688",NA,"GURO, ABDUL MANAN MINUPUN BARAGONA","NPC",TRUE
"42","LAUT, HASIM CAMAD HARON SARIP               HASIM                               INDEPENDENT              9,013","2/9","LANAO DEL SUR","ARMM","board member","1ST DISTRICT"," 9,013",NA,"LAUT, HASIM CAMAD HARON SARIP","INDEPENDENT",TRUE
"43","USMAN TAHIR, H. ABDULAH JAPAR DIALEM DIATOR FARMER                              NPC                      7,036","2/9","LANAO DEL SUR","ARMM","board member","1ST DISTRICT"," 7,036",NA,"USMAN TAHIR, H. ABDULAH JAPAR DIALEM DIATOR FARMER","",TRUE
"44","DIMASAR, JAMAIL TOMAWIS                     JIMMY                               INDEPENDENT              5,913","2/9","LANAO DEL SUR","ARMM","board member","1ST DISTRICT"," 5,913",NA,"DIMASAR, JAMAIL TOMAWIS","INDEPENDENT",TRUE
"45","DIMALUTANG, ZAINODING ANGANAK               DINO                                PDP-LABAN                5,555","2/9","LANAO DEL SUR","ARMM","board member","1ST DISTRICT"," 5,555",NA,"DIMALUTANG, ZAINODING ANGANAK","PDP-LABAN",TRUE
"46","MACAOMBAO, RASUL TANOG                      ROLLY                               INDEPENDENT              5,277","2/9","LANAO DEL SUR","ARMM","board member","1ST DISTRICT"," 5,277",NA,"MACAOMBAO, RASUL TANOG","INDEPENDENT",TRUE
"47","MIMBISA, MOCARAM M.                         TAYA                                INDEPENDENT              5,065","2/9","LANAO DEL SUR","ARMM","board member","1ST DISTRICT"," 5,065",NA,"MIMBISA, MOCARAM M.","INDEPENDENT",TRUE
"48","HASSAN, ALIM ABDULCADER SALIH               CADER                               INDEPENDENT              4,603","2/9","LANAO DEL SUR","ARMM","board member","1ST DISTRICT"," 4,603",NA,"HASSAN, ALIM ABDULCADER SALIH","INDEPENDENT",TRUE
"49","SHARIF, CAMARODEN P.                        CAMAR                               LAKAS NUCD-UMDP          1,447","2/9","LANAO DEL SUR","ARMM","board member","1ST DISTRICT"," 1,447",NA,"SHARIF, CAMARODEN P.","LAKAS NUCD-UMDP",TRUE
"50","HADJI UNOS, MAMADRA LAATAO                  GUDA                                LAKAS NUCD-UMDP          1,142","2/9","LANAO DEL SUR","ARMM","board member","1ST DISTRICT"," 1,142",NA,"HADJI UNOS, MAMADRA LAATAO","LAKAS NUCD-UMDP",TRUE
"51","MANGORANDA, ABUL MAMA                       ABET                                INDEPENDENT               945","2/9","LANAO DEL SUR","ARMM","board member","1ST DISTRICT"," 945",NA,"MANGORANDA, ABUL MAMA","INDEPENDENT",TRUE
"52","MIMBANTAS, HIDIARA MAGANDONG                -                                   INDEPENDENT               374","2/9","LANAO DEL SUR","ARMM","board member","1ST DISTRICT"," 374",NA,"MIMBANTAS, HIDIARA MAGANDONG","",TRUE
"53","BALINDONG, MANGAWAN PACALNA                 MIKE                                LAKAS NUCD-UMDP          30,365   May 23,1995","2/9","LANAO DEL SUR","ARMM","board member","2ND DISTRICT"," 30,365","May 23,1995","BALINDONG, MANGAWAN PACALNA","LAKAS NUCD-UMDP",TRUE
"54","AMIROL, ABDUL WAHAB MHOM                    PANDAPAT                            LAKAS NUCD-UMDP          29,037   May 23,1995","2/9","LANAO DEL SUR","ARMM","board member","2ND DISTRICT"," 29,037","May 23,1995","AMIROL, ABDUL WAHAB MHOM","LAKAS NUCD-UMDP",TRUE
"55","LAO, NASSER AMPUAN                          NASH                                INDEPENDENT              28,547   May 23,1995","2/9","LANAO DEL SUR","ARMM","board member","2ND DISTRICT"," 28,547","May 23,1995","LAO, NASSER AMPUAN","INDEPENDENT",TRUE
"56","DIMAPORO, SOCOR TOLAWIDAN B.                DANNY                               INDEPENDENT              25,950   May 23,1995","2/9","LANAO DEL SUR","ARMM","board member","2ND DISTRICT"," 25,950","May 23,1995","DIMAPORO, SOCOR TOLAWIDAN B.","INDEPENDENT",TRUE
"57","NANAK, TAIB MACATANONG                      ALEEM-TAIB                          LAKAS NUCD-UMDP          23,004","2/9","LANAO DEL SUR","ARMM","board member","2ND DISTRICT"," 23,004",NA,"NANAK, TAIB MACATANONG","LAKAS NUCD-UMDP",TRUE
"58","GURO, MACALINOG DATUDACULA                  PANONDI                             LAKAS NUCD-UMDP          19,380","2/9","LANAO DEL SUR","ARMM","board member","2ND DISTRICT"," 19,380",NA,"GURO, MACALINOG DATUDACULA","LAKAS NUCD-UMDP",TRUE
"59","PUNDOGAR, ABULKHAYER UNTE             ABUL                                INDEPENDENT              18,827","3/9","LANAO DEL SUR","ARMM","board member","2ND DISTRICT"," 18,827",NA,"PUNDOGAR, ABULKHAYER UNTE","INDEPENDENT",TRUE
"60","IBRAHIM, CARIKI N.                    REX                                 LAKAS NUCD-UMDP          15,941","3/9","LANAO DEL SUR","ARMM","board member","2ND DISTRICT"," 15,941",NA,"IBRAHIM, CARIKI N.","LAKAS NUCD-UMDP",TRUE
"61","CALI, FAROUK M.                       ALIM FAROK                          INDEPENDENT              15,440","3/9","LANAO DEL SUR","ARMM","board member","2ND DISTRICT"," 15,440",NA,"CALI, FAROUK M.","INDEPENDENT",TRUE
"62","MACAPAAR, MALIWANAG DIMARO            LIWA                                LAKAS NUCD-UMDP          14,936","3/9","LANAO DEL SUR","ARMM","board member","2ND DISTRICT"," 14,936",NA,"MACAPAAR, MALIWANAG DIMARO","LAKAS NUCD-UMDP",TRUE
"63","GOLING, ABDULMAJID ABUBACAR           ALIM GOLING                         LAKAS NUCD-UMDP          13,710","3/9","LANAO DEL SUR","ARMM","board member","2ND DISTRICT"," 13,710",NA,"GOLING, ABDULMAJID ABUBACAR","LAKAS NUCD-UMDP",TRUE
"64","BALT, ABDULMANAP MORTABA              MANAP                               INDEPENDENT              13,364","3/9","LANAO DEL SUR","ARMM","board member","2ND DISTRICT"," 13,364",NA,"BALT, ABDULMANAP MORTABA","INDEPENDENT",TRUE
"65","TAHA, ALIM RASUL MINANDANG            RASUL                               LAKAS NUCD-UMDP          12,304","3/9","LANAO DEL SUR","ARMM","board member","2ND DISTRICT"," 12,304",NA,"TAHA, ALIM RASUL MINANDANG","LAKAS NUCD-UMDP",TRUE
"66","DAROMOYOD, A. MOHAMMAD SAIDAMIN       AMIN                                LAKAS NUCD-UMDP          11,425","3/9","LANAO DEL SUR","ARMM","board member","2ND DISTRICT"," 11,425",NA,"DAROMOYOD, A. MOHAMMAD SAIDAMIN","LAKAS NUCD-UMDP",TRUE
"67","URONGA, HADJI OMAR D.                 HADJI OMAR                          NPC                      11,321","3/9","LANAO DEL SUR","ARMM","board member","2ND DISTRICT"," 11,321",NA,"URONGA, HADJI OMAR D.","NPC",TRUE
"68","PIANG, NASUOD H. NASSEF SULTAN AMIGOS MARK                                LAKAS NUCD-UMDP          10,794","3/9","LANAO DEL SUR","ARMM","board member","2ND DISTRICT"," 10,794",NA,"PIANG, NASUOD H. NASSEF SULTAN AMIGOS MARK","",TRUE
"69","ABDULCADER, DATAMAN D.                DANTE                               LAKAS NUCD-UMDP          10,787","3/9","LANAO DEL SUR","ARMM","board member","2ND DISTRICT"," 10,787",NA,"ABDULCADER, DATAMAN D.","LAKAS NUCD-UMDP",TRUE
"70","MACASILANG, ALEM RASOL MAROHOM BANSAO RASH                                LAKAS NUCD-UMDP          10,782","3/9","LANAO DEL SUR","ARMM","board member","2ND DISTRICT"," 10,782",NA,"MACASILANG, ALEM RASOL MAROHOM BANSAO RASH","",TRUE
"71","GUNTING, DIGUBATAN ITUA               CADER                               INDEPENDENT              9,717","3/9","LANAO DEL SUR","ARMM","board member","2ND DISTRICT"," 9,717",NA,"GUNTING, DIGUBATAN ITUA","INDEPENDENT",TRUE
"72","MAMBUAY, ALISAIDEN BANGCOLA           TRONICS                             INDEPENDENT              8,915","3/9","LANAO DEL SUR","ARMM","board member","2ND DISTRICT"," 8,915",NA,"MAMBUAY, ALISAIDEN BANGCOLA","INDEPENDENT",TRUE
"73","MAONGCO, ANSARY PACALNA               SASA                                NPC                      8,345","3/9","LANAO DEL SUR","ARMM","board member","2ND DISTRICT"," 8,345",NA,"MAONGCO, ANSARY PACALNA","NPC",TRUE
"74","COTONGAN, PAPALA-DUN MACASUM          POP'S                               NPC                      8,031","3/9","LANAO DEL SUR","ARMM","board member","2ND DISTRICT"," 8,031",NA,"COTONGAN, PAPALA-DUN MACASUM","NPC",TRUE
"75","MINDALANO, CALIPH FARUK D.            CALIPH                              LAKAS NUCD-UMDP          6,084","3/9","LANAO DEL SUR","ARMM","board member","2ND DISTRICT"," 6,084",NA,"MINDALANO, CALIPH FARUK D.","LAKAS NUCD-UMDP",TRUE
"76","SULTAN GAUS, DIMAPUNDUG MAMONGCARA    GAUS                                LAKAS NUCD-UMDP          5,587","3/9","LANAO DEL SUR","ARMM","board member","2ND DISTRICT"," 5,587",NA,"SULTAN GAUS, DIMAPUNDUG MAMONGCARA","",TRUE
"77","PUKUNUM, HADJI JAVIER LAIDAN          SULTAN                              NPC                      3,894","3/9","LANAO DEL SUR","ARMM","board member","2ND DISTRICT"," 3,894",NA,"PUKUNUM, HADJI JAVIER LAIDAN","NPC",TRUE
"78","TALIB, OMBRA BELGADER                 RADIAMODA                           LAKAS NUCD-UMDP          2,557","3/9","LANAO DEL SUR","ARMM","board member","2ND DISTRICT"," 2,557",NA,"TALIB, OMBRA BELGADER","LAKAS NUCD-UMDP",TRUE
"79","PETEILAN, ESMAIL DIAMLA               MAIL                                INDEPENDENT              2,372","3/9","LANAO DEL SUR","ARMM","board member","2ND DISTRICT"," 2,372",NA,"PETEILAN, ESMAIL DIAMLA","INDEPENDENT",TRUE
"80","MANGONDAYA, DIMASANGCA D.             DIMAR                               NPC                      2,343","3/9","LANAO DEL SUR","ARMM","board member","2ND DISTRICT"," 2,343",NA,"MANGONDAYA, DIMASANGCA D.","NPC",TRUE
"81","SULTAN MAMISCAL, ABDUL MAJID S.       ABY TASHNIEM                        LAKAS NUCD-UMDP          1,704","3/9","LANAO DEL SUR","ARMM","board member","2ND DISTRICT"," 1,704",NA,"SULTAN MAMISCAL, ABDUL MAJID S.","LAKAS NUCD-UMDP",TRUE
"82","SANGCOPAN, MACAISUG BANDARA           MIKE                                INDEPENDENT              1,120","3/9","LANAO DEL SUR","ARMM","board member","2ND DISTRICT"," 1,120",NA,"SANGCOPAN, MACAISUG BANDARA","INDEPENDENT",TRUE
"83","TABUA, PAISAL PENTANAN                PANY                                INDEPENDENT               665","3/9","LANAO DEL SUR","ARMM","board member","2ND DISTRICT"," 665",NA,"TABUA, PAISAL PENTANAN","INDEPENDENT",TRUE
"84","SANTICAN, ABDULRAHMAN MACOD BANGON    MAC                                 INDEPENDENT               210","3/9","LANAO DEL SUR","ARMM","board member","2ND DISTRICT"," 210",NA,"SANTICAN, ABDULRAHMAN MACOD BANGON","",TRUE
"85","*DILANGALEN, DIDAGEN PIANG       DIGS                               NPC                      71,302  March 26,1996 SPC # 95-167","4/9","MAGUINDANAO","ARMM","congressman","1ST DISTRICT"," 71,302","March 26,1996","*DILANGALEN, DIDAGEN PIANG","NPC",TRUE
"86","MASTURA, MICHAEL ONG            MIKE                               LAKAS NUCD-UMDP          68,714","4/9","MAGUINDANAO","ARMM","congressman","1ST DISTRICT"," 68,714",NA,"MASTURA, MICHAEL ONG","LAKAS NUCD-UMDP",TRUE
"87","DATUMANONG, SIMEON AMPATUAN     SIM                                LAKAS NUCD-UMDP          65,869","4/9","MAGUINDANAO","ARMM","congressman","2ND DISTRICT"," 65,869",NA,"DATUMANONG, SIMEON AMPATUAN","LAKAS NUCD-UMDP",TRUE
"88","MENTANG, PIKE TERANDO           PIKE                               NPC                      40,658","4/9","MAGUINDANAO","ARMM","congressman","2ND DISTRICT"," 40,658",NA,"MENTANG, PIKE TERANDO","NPC",TRUE
"89","CANDAO, ZACARIA AMAG            ZACK                               LABAN (LDP)             157,844   June 30,1995","4/9","MAGUINDANAO","ARMM","governor",""," 157,844","June 30,1995","CANDAO, ZACARIA AMAG","LABAN (LDP)",TRUE
"90","MATALAM, NORODIN M.             NOR                                LAKAS NUCD-UMDP         118,034","4/9","MAGUINDANAO","ARMM","governor",""," 118,034",NA,"MATALAM, NORODIN M.","LAKAS NUCD-UMDP",TRUE
"91","PUSO, IBRAHIM KANUBPAL          BLAH                                LP                       728","4/9","MAGUINDANAO","ARMM","governor",""," 728",NA,"PUSO, IBRAHIM KANUBPAL","LP",TRUE
"92","MIDTIMBANG, MIDPANTAO MUSA      DATU ANTAO                         LABAN (LDP)             163,063   June 12,1995","4/9","MAGUINDANAO","ARMM","vice governor",""," 163,063","June 12,1995","MIDTIMBANG, MIDPANTAO MUSA","LABAN (LDP)",TRUE
"93","BIRUAR, PAGRAS DIMARAO          GRA                                LAKAS NUCD-UMDP          80,494","4/9","MAGUINDANAO","ARMM","vice governor",""," 80,494",NA,"BIRUAR, PAGRAS DIMARAO","LAKAS NUCD-UMDP",TRUE
"94","MANGELEN, DATU SALEH TEMPOLOK   DATU BONDO                         NPC                      4,652","4/9","MAGUINDANAO","ARMM","vice governor",""," 4,652",NA,"MANGELEN, DATU SALEH TEMPOLOK   DATU BONDO","",TRUE
"95","SAPAK, SAMMY D.                 SAMMY                              INDEPENDENT              1,076","4/9","MAGUINDANAO","ARMM","vice governor",""," 1,076",NA,"SAPAK, SAMMY D.","INDEPENDENT",TRUE
"96","MACAPEGES, GAMAL ALI            JAM                                LABAN (LDP)              42,270   June 12,1995","4/9","MAGUINDANAO","ARMM","board member","1ST DISTRICT"," 42,270","June 12,1995","MACAPEGES, GAMAL ALI","LABAN (LDP)",TRUE
"97","KANAKAN, MOHAMMAD PIANG         DR. CARABAO                        LAKAS NUCD-UMDP          40,006   June 12,1995","4/9","MAGUINDANAO","ARMM","board member","1ST DISTRICT"," 40,006","June 12,1995","KANAKAN, MOHAMMAD PIANG","LAKAS NUCD-UMDP",TRUE
"98","DIRANGAREN, MICHAEL BATANGCOROP MAK                                LAKAS NUCD-UMDP          37,419   June 12,1995","4/9","MAGUINDANAO","ARMM","board member","1ST DISTRICT"," 37,419","June 12,1995","DIRANGAREN, MICHAEL BATANGCOROP MAK","",TRUE
"99","MARANDANG, ESMAEL MACABAO       MIKE                               LAKAS NUCD-UMDP          36,728   June 12,1995","4/9","MAGUINDANAO","ARMM","board member","1ST DISTRICT"," 36,728","June 12,1995","MARANDANG, ESMAEL MACABAO","LAKAS NUCD-UMDP",TRUE
"100","TIOLO, PATULA OMBAC             PAT                                -                        31,991    July 1,1995","4/9","MAGUINDANAO","ARMM","board member","1ST DISTRICT"," 31,991","July 1,1995","TIOLO, PATULA OMBAC","-",TRUE
"101","TOMAWIS, HAJA ZAIDA -           MOLING                             INDEPENDENT              29,977","4/9","MAGUINDANAO","ARMM","board member","1ST DISTRICT"," 29,977",NA,"TOMAWIS, HAJA ZAIDA -","INDEPENDENT",TRUE
"102","BIRVAR, JOHAINA S.              BAI SALLY                          LAKAS NUCD-UMDP          27,652","4/9","MAGUINDANAO","ARMM","board member","1ST DISTRICT"," 27,652",NA,"BIRVAR, JOHAINA S.","LAKAS NUCD-UMDP",TRUE
"103","MAMBUAY, ABDULWAHAB BARAGUIR    ALEX                               PRP                      25,637","4/9","MAGUINDANAO","ARMM","board member","1ST DISTRICT"," 25,637",NA,"MAMBUAY, ABDULWAHAB BARAGUIR","",TRUE
"104","BIRVAR, MAGSAYSAY BIRVAR        SAYSAY                             LAKAS NUCD-UMDP          21,565","4/9","MAGUINDANAO","ARMM","board member","1ST DISTRICT"," 21,565",NA,"BIRVAR, MAGSAYSAY BIRVAR","LAKAS NUCD-UMDP",TRUE
"105","ALI, GABASAN PATARANDANG        GABBY                              LABAN (LDP)              17,673","4/9","MAGUINDANAO","ARMM","board member","1ST DISTRICT"," 17,673",NA,"ALI, GABASAN PATARANDANG","LABAN (LDP)",TRUE
"106","CAMPONG, HADJI ZAINAL ABEDIN    ZAINAL                             LABAN (LDP)              15,683","4/9","MAGUINDANAO","ARMM","board member","1ST DISTRICT"," 15,683",NA,"CAMPONG, HADJI ZAINAL ABEDIN","LABAN (LDP)",FALSE
"107","DICAY, CARLITO A.               LITO                               INDEPENDENT              15,361","4/9","MAGUINDANAO","ARMM","board member","1ST DISTRICT"," 15,361",NA,"DICAY, CARLITO A.","INDEPENDENT",TRUE
"108","BARAGUIR, MOHAMMAD ABDULAZIZ    MAO                                LABAN (LDP)              15,068","4/9","MAGUINDANAO","ARMM","board member","1ST DISTRICT"," 15,068",NA,"BARAGUIR, MOHAMMAD ABDULAZIZ","LABAN (LDP)",FALSE
"109","ABOBAKAR, AVILA DRIS APAN         AVI                                 NPC                      13,774","5/9","MAGUINDANAO","ARMM","board member","1ST DISTRICT"," 13,774",NA,"ABOBAKAR, AVILA DRIS APAN","NPC",TRUE
"110","MAPANDALA, DATUMAMA SINSUAT       MAMA                                NPC                      13,417","5/9","MAGUINDANAO","ARMM","board member","1ST DISTRICT"," 13,417",NA,"MAPANDALA, DATUMAMA SINSUAT","NPC",TRUE
