"","V1","page","province","region","position","district","votes","proclamation_date","name","party","has_nickname"
"257","GABAO, CATALINO JR. V.                                        NUCD                     4,848","11/18","CATANDUANES","05","vice governor",""," 4,848",NA,"GABAO, CATALINO JR. V.","",TRUE
"258","ARCILLA, SALVADOR JR. A.                                      LDP                      4,214","11/18","CATANDUANES","05","vice governor",""," 4,214",NA,"ARCILLA, SALVADOR JR. A.","",TRUE
"259","TEJADA, PIO R.                                                NUCD                     3,896","11/18","CATANDUANES","05","vice governor",""," 3,896",NA,"TEJADA, PIO R.","",TRUE
"260","DE LEON, JORGE A.                                             LDP                      3,493","11/18","CATANDUANES","05","vice governor",""," 3,493",NA,"DE LEON, JORGE A.","",TRUE
"261","SURBAN, FELIPE V.                                             LP/PDP                   3,270","11/18","CATANDUANES","05","vice governor",""," 3,270",NA,"SURBAN, FELIPE V.","",TRUE
"262","REYES, BENITA T.                                              LP/PDP                   3,240","11/18","CATANDUANES","05","vice governor",""," 3,240",NA,"REYES, BENITA T.","",TRUE
"263","RUBIO, GREGORIO S.                                            INDEPENDENT              3,158","11/18","CATANDUANES","05","vice governor",""," 3,158",NA,"RUBIO, GREGORIO S.","",TRUE
"264","ARCILLA, NAPOLEON S.                                          INDEPENDENT              3,103","11/18","CATANDUANES","05","vice governor",""," 3,103",NA,"ARCILLA, NAPOLEON S.","",TRUE
"265","SARMIENTO, SALVADOR -                                         NPC                      2,769","11/18","CATANDUANES","05","vice governor",""," 2,769",NA,"SARMIENTO, SALVADOR -","",TRUE
"266","BAGADIONG, JOSE V.                                            NPC                      2,758","11/18","CATANDUANES","05","vice governor",""," 2,758",NA,"BAGADIONG, JOSE V.","",TRUE
"267","CASTILLO, JOSE R.                                             NPC                      2,174","11/18","CATANDUANES","05","vice governor",""," 2,174",NA,"CASTILLO, JOSE R.","",TRUE
"268","PANTI, ROMULO R.                                              KBL                      1,914","11/18","CATANDUANES","05","vice governor",""," 1,914",NA,"PANTI, ROMULO R.","",TRUE
"269","SOLANO, SIMPLICIO A.                                          NPC                      1,772","11/18","CATANDUANES","05","vice governor",""," 1,772",NA,"SOLANO, SIMPLICIO A.","",TRUE
"270","SOLO, NESTOR C.                                               LP                       1,147","11/18","CATANDUANES","05","vice governor",""," 1,147",NA,"SOLO, NESTOR C.","",TRUE
"271","PANTI, AGUSTIN B.                                             NPC/LP                    790","11/18","CATANDUANES","05","vice governor",""," 790",NA,"PANTI, AGUSTIN B.","",TRUE
"272","SONEJA, MOISES JR. P.                                         INDEPENDENT               760","11/18","CATANDUANES","05","vice governor",""," 760",NA,"SONEJA, MOISES JR. P.","",TRUE
"273","TABLIZO, LINA G.                                              KBL                       345","11/18","CATANDUANES","05","vice governor",""," 345",NA,"TABLIZO, LINA G.","",TRUE
"274","VARGAS, MAMERTA S.                                            KBL                       196","11/18","CATANDUANES","05","vice governor",""," 196",NA,"VARGAS, MAMERTA S.","",TRUE
"275","AGUILAR, CARLOS M.            LINDOY                          LAKAS-NUCD               7,557    May 25,1992","11/18","CATANDUANES","05","vice governor",""," 7,557","May 25,1992","AGUILAR, CARLOS M.","LAKAS-NUCD",TRUE
"276","EVANGELISTA, LILIA V.         LILY                            LAKAS-NUCD               7,201    May 25,1992","11/18","CATANDUANES","05","vice governor",""," 7,201","May 25,1992","EVANGELISTA, LILIA V.","LAKAS-NUCD",TRUE
"277","DE LOS SANTOS, FRANCISCO T.   KIKOY                           LDP                      5,622    May 25,1992","11/18","CATANDUANES","05","vice governor",""," 5,622","May 25,1992","DE LOS SANTOS, FRANCISCO T.   KIKOY","",TRUE
"278","UBALDE, DOLORES T.                                            LDP                      5,363","11/18","CATANDUANES","05","vice governor",""," 5,363",NA,"UBALDE, DOLORES T.","",TRUE
"279","TAPERLA, ANTONIO T.                                           NUCD                     4,103","11/18","CATANDUANES","05","vice governor",""," 4,103",NA,"TAPERLA, ANTONIO T.","",TRUE
"280","RODRIGUEZ, EFREN R.                                           NPC                      3,515","11/18","CATANDUANES","05","vice governor",""," 3,515",NA,"RODRIGUEZ, EFREN R.","",TRUE
"281","MENDOZA, ELY T.                                               INDEPENDENT              3,237","11/18","CATANDUANES","05","vice governor",""," 3,237",NA,"MENDOZA, ELY T.","",TRUE
"282","TRESVALLES, FLORO -                                           INDEPENDENT              2,699","11/18","CATANDUANES","05","vice governor",""," 2,699",NA,"TRESVALLES, FLORO -","",TRUE
"283","RODULFO, PIO II T.                                            KBL                      2,147","11/18","CATANDUANES","05","vice governor",""," 2,147",NA,"RODULFO, PIO II T.","",TRUE
"284","TRINIDAD, JEREMIAS O.                                         KBL                      2,042","11/18","CATANDUANES","05","vice governor",""," 2,042",NA,"TRINIDAD, JEREMIAS O.","",TRUE
"285","LOPEZ, JOVEL -                                                NPC                      2,019","11/18","CATANDUANES","05","vice governor",""," 2,019",NA,"LOPEZ, JOVEL -","",TRUE
"286","CABRERA, QUIRICO S.                                           LDP                      2,018","11/18","CATANDUANES","05","vice governor",""," 2,018",NA,"CABRERA, QUIRICO S.","",TRUE
"287","SANCHEZ, ANTONIO G.                                           INDEPENDENT              1,973","11/18","CATANDUANES","05","vice governor",""," 1,973",NA,"SANCHEZ, ANTONIO G.","",TRUE
"288","ROJAS, JOSE T.                                        INDEPENDENT              1,843","12/18","CATANDUANES","05","vice governor",""," 1,843",NA,"ROJAS, JOSE T.","",TRUE
"289","OLANKA, ARNOLD T.                                     PDP                      1,622","12/18","CATANDUANES","05","vice governor",""," 1,622",NA,"OLANKA, ARNOLD T.","",TRUE
"290","SALOME, RUFINO T.                                     NPC                      1,483","12/18","CATANDUANES","05","vice governor",""," 1,483",NA,"SALOME, RUFINO T.","",TRUE
"291","DAYAWAN, ALFREDO SR. T.                               KBL                      1,364","12/18","CATANDUANES","05","vice governor",""," 1,364",NA,"DAYAWAN, ALFREDO SR. T.","",TRUE
"292","OLFINDO, ARSENIO T.                                   NPC/LP                   1,310","12/18","CATANDUANES","05","vice governor",""," 1,310",NA,"OLFINDO, ARSENIO T.","",TRUE
"293","BAYONITO, MARIO T.                                    PDP                      1,164","12/18","CATANDUANES","05","vice governor",""," 1,164",NA,"BAYONITO, MARIO T.","",TRUE
"294","TUGAY, JOSUE T.                                       INP                      1,066","12/18","CATANDUANES","05","vice governor",""," 1,066",NA,"TUGAY, JOSUE T.","",TRUE
"295","TATAD, DIOSDADO T.                                    KBL                       738","12/18","CATANDUANES","05","vice governor",""," 738",NA,"TATAD, DIOSDADO T.","",TRUE
"296","ESPINOSA, TITO R.             TITO                            LDP                      19,286   May 21,1992","13/18","MASBATE","05","congressman","1ST DISTRICT"," 19,286","May 21,1992","ESPINOSA, TITO R.","LDP",TRUE
"297","BUNAN, MANUEL G.                                              LAKAS-NUCD               14,883","13/18","MASBATE","05","congressman","1ST DISTRICT"," 14,883",NA,"BUNAN, MANUEL G.","",TRUE
"298","ALMINE, TEODORICO SR. C.                                      INDEPENDENT              1,038","13/18","MASBATE","05","congressman","1ST DISTRICT"," 1,038",NA,"ALMINE, TEODORICO SR. C.","",TRUE
"299","BAKUNAWA, LUZ CLETA R.        LUZ                             LDP                      35,215   May 22,1992","13/18","MASBATE","05","congressman","2ND DISTRICT"," 35,215","May 22,1992","BAKUNAWA, LUZ CLETA R.","LDP",TRUE
"300","DANAO, ORLANDO M.                                             LP/PDP/NPC COAL          14,007","13/18","MASBATE","05","congressman","2ND DISTRICT"," 14,007",NA,"DANAO, ORLANDO M.","",TRUE
"301","OLIVA, EDELSON G.                                             INDEPENDENT              5,249","13/18","MASBATE","05","congressman","2ND DISTRICT"," 5,249",NA,"OLIVA, EDELSON G.","",TRUE
"302","PUJOL, LILY S.                                                LAKAS-NUCD               5,177","13/18","MASBATE","05","congressman","2ND DISTRICT"," 5,177",NA,"PUJOL, LILY S.","",TRUE
"303","KHO, ANTONIO T.               TERY                            LAKAS-NUCD               31,095   May 20,1992","13/18","MASBATE","05","congressman","3RD DISTRICT"," 31,095","May 20,1992","KHO, ANTONIO T.","LAKAS-NUCD",TRUE
"304","ESPINOSA, MOISES JR. K.                                       INDEPENDENT              23,825","13/18","MASBATE","05","congressman","3RD DISTRICT"," 23,825",NA,"ESPINOSA, MOISES JR. K.","",TRUE
"305","ALINO, ALFONSO SR. H.                                         WORKER'S PARTY           4,554","13/18","MASBATE","05","congressman","3RD DISTRICT"," 4,554",NA,"ALINO, ALFONSO SR. H.","",TRUE
"306","TAMBAGO, REGINO B.                                            LDP                      2,427","13/18","MASBATE","05","congressman","3RD DISTRICT"," 2,427",NA,"TAMBAGO, REGINO B.","",TRUE
"307","LIM, VICENTE SR. P.                                           INDEPENDENT               733","13/18","MASBATE","05","congressman","3RD DISTRICT"," 733",NA,"LIM, VICENTE SR. P.","",TRUE
"308","ARIZALA, FLORESTO T.                                          NP                        559","13/18","MASBATE","05","congressman","3RD DISTRICT"," 559",NA,"ARIZALA, FLORESTO T.","",TRUE
"309","SALUBRE, CONSTANCIO O.                                        PRRP                       22","13/18","MASBATE","05","congressman","3RD DISTRICT"," 22",NA,"SALUBRE, CONSTANCIO O.","",TRUE
"310","ESINOSA, EMILIO JR. R.        MILING                          NPC/INA                  70,879   May 22,1992","13/18","MASBATE","05","governor",""," 70,879","May 22,1992","ESINOSA, EMILIO JR. R.","NPC/INA",TRUE
"311","BAKUNAWA, MANUEL JR. N.                                       LDP                      52,708","13/18","MASBATE","05","governor",""," 52,708",NA,"BAKUNAWA, MANUEL JR. N.","",TRUE
"312","FERNANDEZ, MERLENE B.                                         LP-PDP                   36,897","13/18","MASBATE","05","governor",""," 36,897",NA,"FERNANDEZ, MERLENE B.","",TRUE
"313","LIM, VICENTE JR. Y.                                           LAKAS-NUCD               5,598","13/18","MASBATE","05","governor",""," 5,598",NA,"LIM, VICENTE JR. Y.","",TRUE
"314","BAUTISTA, PABLO M.                                            KBL                      1,001","13/18","MASBATE","05","governor",""," 1,001",NA,"BAUTISTA, PABLO M.","",TRUE
"315","BUTALID, RAINIER B.           RAINER                          INDEPENDENT              54,024   May 22,1992","13/18","MASBATE","05","vice governor",""," 54,024","May 22,1992","BUTALID, RAINIER B.","INDEPENDENT",TRUE
"316","ESPARES, MARIANO S.                                           INA-NPC                  46,494","13/18","MASBATE","05","vice governor",""," 46,494",NA,"ESPARES, MARIANO S.","",TRUE
"317","YANEZA, RUDY L.                                               KBL                      6,383","13/18","MASBATE","05","vice governor",""," 6,383",NA,"YANEZA, RUDY L.","",TRUE
"318","CLEMENTE, HONRADO A.                                          KBL                      2,369","13/18","MASBATE","05","vice governor",""," 2,369",NA,"CLEMENTE, HONRADO A.","",TRUE
"319","BAGALIHOG, NONILON A.                                         LP-PDP                   1,889","13/18","MASBATE","05","vice governor",""," 1,889",NA,"BAGALIHOG, NONILON A.","",TRUE
"320","CLEMENTE, ANGELITO A.          LITO                             LDP                      7,634    May 22,1992","14/18","MASBATE","05","vice governor",""," 7,634","May 22,1992","CLEMENTE, ANGELITO A.","LDP",TRUE
"321","GUETA, GERONIMO SR. A.         IMO                              LAKAS-NUCD               7,001    May 22,1992","14/18","MASBATE","05","vice governor",""," 7,001","May 22,1992","GUETA, GERONIMO SR. A.","LAKAS-NUCD",TRUE
"322","LLACER, ANTONIO B.                                              INA-NPC                  6,991","14/18","MASBATE","05","vice governor",""," 6,991",NA,"LLACER, ANTONIO B.","",TRUE
"323","MONTENEGRO, ROGELIO G.                                          LAKAS-NUCD               6,349","14/18","MASBATE","05","vice governor",""," 6,349",NA,"MONTENEGRO, ROGELIO G.","",TRUE
"324","ALBA, ARTEMIO C.                                                LDP                      6,166","14/18","MASBATE","05","vice governor",""," 6,166",NA,"ALBA, ARTEMIO C.","",TRUE
"325","REJUSO, ALONSO A.                                               LP-PDP                   5,356","14/18","MASBATE","05","vice governor",""," 5,356",NA,"REJUSO, ALONSO A.","",TRUE
"326","REVIL, ARTURO CLEMENTE B.      ARMEN                            LDP                      23,385   May 22,1992","14/18","MASBATE","05","vice governor",""," 23,385","May 22,1992","REVIL, ARTURO CLEMENTE B.","LDP",TRUE
"327","CELERA, RICARDO P.             RICKY                            LP                       18,312   May 22,1992","14/18","MASBATE","05","vice governor",""," 18,312","May 22,1992","CELERA, RICARDO P.","LP",TRUE
"328","LEGASPI, EDGAR O.              EGAY                             LDP                      14,780   May 22,1992","14/18","MASBATE","05","vice governor",""," 14,780","May 22,1992","LEGASPI, EDGAR O.","LDP",TRUE
"329","BANTILING, HARVEY M.                                            INA-NPC                  13,730  August 17,1992","14/18","MASBATE","05","vice governor",""," 13,730","August 17,1992","BANTILING, HARVEY M.","",TRUE
"330","SONGCO, RUBEN A.                                                INA-NPC                  13,583","14/18","MASBATE","05","vice governor",""," 13,583",NA,"SONGCO, RUBEN A.","",TRUE
"331","BRAVO, NARCISO G.                                               INA-NPC                  12,357","14/18","MASBATE","05","vice governor",""," 12,357",NA,"BRAVO, NARCISO G.","",TRUE
"332","VILLAMOR, HONESTO -                                             LDP                      12,123","14/18","MASBATE","05","vice governor",""," 12,123",NA,"VILLAMOR, HONESTO -","",TRUE
"333","ZAFRA, JOSE JR J                                                LDP                      10,943","14/18","MASBATE","05","vice governor",""," 10,943",NA,"ZAFRA, JOSE JR J","",TRUE
"334","ROMA, QUIRINO D.                                                INA-NPC                  10,764","14/18","MASBATE","05","vice governor",""," 10,764",NA,"ROMA, QUIRINO D.","",TRUE
"335","PUNAY, PIO JR R.                                                LP-PDP                   5,439","14/18","MASBATE","05","vice governor",""," 5,439",NA,"PUNAY, PIO JR R.","",TRUE
"336","CAMPO, MANUEL JR. C.                                            LP-PDP                   4,278","14/18","MASBATE","05","vice governor",""," 4,278",NA,"CAMPO, MANUEL JR. C.","",TRUE
"337","ESPINAS, MIGUEL JR. B.                                          LAKAS-NUCD               3,883","14/18","MASBATE","05","vice governor",""," 3,883",NA,"ESPINAS, MIGUEL JR. B.","",TRUE
"338","OLIVA, CAYO L.                                                  LAKAS-NUCD               3,411","14/18","MASBATE","05","vice governor",""," 3,411",NA,"OLIVA, CAYO L.","",TRUE
"339","NAVARRO, ANDRES III B.                                          LAKAS-NUCD               2,101","14/18","MASBATE","05","vice governor",""," 2,101",NA,"NAVARRO, ANDRES III B.","",TRUE
"340","ESTRELLA, OSCAR R.                                              KBL                       737","14/18","MASBATE","05","vice governor",""," 737",NA,"ESTRELLA, OSCAR R.","",TRUE
"341","ANGUSTIA, VICENTE L.                                            KBL                       705","14/18","MASBATE","05","vice governor",""," 705",NA,"ANGUSTIA, VICENTE L.","",TRUE
"342","FUENTES, DILORD O.                                              KBL                       555","14/18","MASBATE","05","vice governor",""," 555",NA,"FUENTES, DILORD O.","",TRUE
"343","QUINTANAR, EDMUNDO V.                                           PMP                       393","14/18","MASBATE","05","vice governor",""," 393",NA,"QUINTANAR, EDMUNDO V.","",TRUE
"344","GAZA, LOLITO R.                                                 LP/PDP COAL               317","14/18","MASBATE","05","vice governor",""," 317",NA,"GAZA, LOLITO R.","",TRUE
"345","GARGANTA, FERDINAND A.                                          PMP                       248","14/18","MASBATE","05","vice governor",""," 248",NA,"GARGANTA, FERDINAND A.","",TRUE
"346","MANGUBAT, EPITACIO R.          EPIT                             INA/NPC                  20,535   May 22,1992","14/18","MASBATE","05","vice governor",""," 20,535","May 22,1992","MANGUBAT, EPITACIO R.","INA/NPC",TRUE
"347","LIM, FRANCISCO T.              KHEKING                          INA/NPC                  19,952   May 22,1992","14/18","MASBATE","05","vice governor",""," 19,952","May 22,1992","LIM, FRANCISCO T.","INA/NPC",TRUE
"348","ALAMARIO, ALEX G.              ALEX                             INA/NPC                  19,334   May 22,1992","14/18","MASBATE","05","vice governor",""," 19,334","May 22,1992","ALAMARIO, ALEX G.","INA/NPC",TRUE
"349","GADIA, RUPERTO C.              PERT                             LP-PDP                   15,912   May 22,1992","14/18","MASBATE","05","vice governor",""," 15,912","May 22,1992","GADIA, RUPERTO C.","LP-PDP",TRUE
"350","PECSON, MATEO JR. J                                             LP/NUCD/PDP              13,816","14/18","MASBATE","05","vice governor",""," 13,816",NA,"PECSON, MATEO JR. J","",TRUE
"351","RAMIREZ, FILOMENO O.                                            KBL                      11,953","14/18","MASBATE","05","vice governor",""," 11,953",NA,"RAMIREZ, FILOMENO O.","",TRUE
"352","APALLA, RODOLFO M.                                              LP/PDP/NUCD              10,109","14/18","MASBATE","05","vice governor",""," 10,109",NA,"APALLA, RODOLFO M.","",TRUE
"353","BANDA, ANUNCIATION C.                                INA-NPC                  8,879","15/18","MASBATE","05","vice governor",""," 8,879",NA,"BANDA, ANUNCIATION C.","",TRUE
"354","CALOLOT, CLEMENTE A.                                 LDP                      8,677","15/18","MASBATE","05","vice governor",""," 8,677",NA,"CALOLOT, CLEMENTE A.","",TRUE
"355","TAMAYO, EDGAR J                                      KBL                      1,884","15/18","MASBATE","05","vice governor",""," 1,884",NA,"TAMAYO, EDGAR J","",TRUE
"356","BAJAR, NESTOR F.                                     LP                       1,858","15/18","MASBATE","05","vice governor",""," 1,858",NA,"BAJAR, NESTOR F.","",TRUE
"357","VIRAQUE, CONSTANCIO M.                               KBL-NP                    813","15/18","MASBATE","05","vice governor",""," 813",NA,"VIRAQUE, CONSTANCIO M.","",TRUE
"358","ESCUDERO, SALVADOR III H.      SONNY                              NPC                      30,352   May 20,1992","16/18","SORSOGON","05","congressman","1ST DISTRICT"," 30,352","May 20,1992","ESCUDERO, SALVADOR III H.","NPC",TRUE
"359","DIAZ, ELIZALDE D.                                                 LP/PDP                   23,737","16/18","SORSOGON","05","congressman","1ST DISTRICT"," 23,737",NA,"DIAZ, ELIZALDE D.","",TRUE
"360","AQUINO, RAFAEL C.                                                 LAKAS-NUCD               13,709","16/18","SORSOGON","05","congressman","1ST DISTRICT"," 13,709",NA,"AQUINO, RAFAEL C.","",TRUE
"361","HUAB, ANTONIO R.                                                  LDP                      9,172","16/18","SORSOGON","05","congressman","1ST DISTRICT"," 9,172",NA,"HUAB, ANTONIO R.","",TRUE
"362","BERENGUER, SILVERIO J                                             LAKAS-NUCD                808","16/18","SORSOGON","05","congressman","1ST DISTRICT"," 808",NA,"BERENGUER, SILVERIO J","",TRUE
"363","SALAZAR, PEDRO F.                                                 LP/KBL                     62","16/18","SORSOGON","05","congressman","1ST DISTRICT"," 62",NA,"SALAZAR, PEDRO F.","",TRUE
"364","GILLEGO, BONIFACIO H.          BONING                             LAKAS-NUCD               29,949   May 22,1992","16/18","SORSOGON","05","congressman","2ND DISTRICT"," 29,949","May 22,1992","GILLEGO, BONIFACIO H.","LAKAS-NUCD",TRUE
"365","SABATER, JOSE E.                                                  NPC                      24,590","16/18","SORSOGON","05","congressman","2ND DISTRICT"," 24,590",NA,"SABATER, JOSE E.","",TRUE
"366","TALATALA, MARIO R.                                                LDP                      23,697","16/18","SORSOGON","05","congressman","2ND DISTRICT"," 23,697",NA,"TALATALA, MARIO R.","",TRUE
"367","DIVINA, SAMSON D.                                                 NP                       2,157","16/18","SORSOGON","05","congressman","2ND DISTRICT"," 2,157",NA,"DIVINA, SAMSON D.","",TRUE
"368","LEE, CONRADO G.                                                   KBL                       758","16/18","SORSOGON","05","congressman","2ND DISTRICT"," 758",NA,"LEE, CONRADO G.","",TRUE
"369","ESTAYAN, MARIO F.                                                 LP/PDP                    544","16/18","SORSOGON","05","congressman","2ND DISTRICT"," 544",NA,"ESTAYAN, MARIO F.","",TRUE
"370","FULGAR, MANUEL C.                                                 KBL                       286","16/18","SORSOGON","05","congressman","2ND DISTRICT"," 286",NA,"FULGAR, MANUEL C.","",TRUE
"371","FRIVALDO, JUAN G.              TATA OWAN                          LAKAS-NUCD               94,846   May 22,1992","16/18","SORSOGON","05","governor",""," 94,846","May 22,1992","FRIVALDO, JUAN G.","LAKAS-NUCD",TRUE
"372","LEE, RAUL R.                                                      LDP                      37,916","16/18","SORSOGON","05","governor",""," 37,916",NA,"LEE, RAUL R.","",TRUE
"373","ORTIZ, AUGUSTO G.                                                 NPC                      35,368","16/18","SORSOGON","05","governor",""," 35,368",NA,"ORTIZ, AUGUSTO G.","",TRUE
"374","GUYSAYCO, ERWIN G.                                                LP/PDP                   3,067","16/18","SORSOGON","05","governor",""," 3,067",NA,"GUYSAYCO, ERWIN G.","",TRUE
"375","DE VERA, RAMON C.                                                 INDEPENDENT               490","16/18","SORSOGON","05","governor",""," 490",NA,"DE VERA, RAMON C.","",TRUE
"376","TERRADO, PEDRO JR. P.                                             KBL                       198","16/18","SORSOGON","05","governor",""," 198",NA,"TERRADO, PEDRO JR. P.","",TRUE
"377","ESCUDERO, ANTONIO JR. H.       KRUNI                              NPC-PP                   39,148   May 22,1992","16/18","SORSOGON","05","vice governor",""," 39,148","May 22,1992","ESCUDERO, ANTONIO JR. H.","NPC-PP",TRUE
"378","BARLIN, GAVINO L.                                                 LDP                      33,379","16/18","SORSOGON","05","vice governor",""," 33,379",NA,"BARLIN, GAVINO L.","",TRUE
"379","OCAMPO, ISAGANI P.                                                LAKAS-NUCD               27,042","16/18","SORSOGON","05","vice governor",""," 27,042",NA,"OCAMPO, ISAGANI P.","",TRUE
"380","AQUINO, RODOLFO N.                                                INDEPENDENT              20,532","16/18","SORSOGON","05","vice governor",""," 20,532",NA,"AQUINO, RODOLFO N.","",TRUE
"381","PERETE, ARNULFO L.                                                LP/PDP                   13,402","16/18","SORSOGON","05","vice governor",""," 13,402",NA,"PERETE, ARNULFO L.","",TRUE
"382","GOLPEO, ABSALON G.                                                NP                       4,306","16/18","SORSOGON","05","vice governor",""," 4,306",NA,"GOLPEO, ABSALON G.","",TRUE
"383","PERALTA, VICENTE JR. B.                                           KBL                      1,026","16/18","SORSOGON","05","vice governor",""," 1,026",NA,"PERALTA, VICENTE JR. B.","",TRUE
"384","LIAO, GLORIA G.                                                   KBL                       685","16/18","SORSOGON","05","vice governor",""," 685",NA,"LIAO, GLORIA G.","",TRUE
"385","OIDEM, LORETO E.                                              INDEPENDENT                31","17/18","SORSOGON","05","vice governor",""," 31",NA,"OIDEM, LORETO E.","",TRUE
"386","DEALCA, JUAN S.              JOHNNY                           NPC-PP                   17,381   May 22,1992","17/18","SORSOGON","05","board member","1ST DISTRICT"," 17,381","May 22,1992","DEALCA, JUAN S.","NPC-PP",TRUE
"387","MENDOZA, RAYMUNDO A.         MUNDING                          NPC-PP                   15,465   May 22,1992","17/18","SORSOGON","05","board member","1ST DISTRICT"," 15,465","May 22,1992","MENDOZA, RAYMUNDO A.","NPC-PP",TRUE
"388","MELLA, FULGENCIO JR. A.      TELO                             NPC                      13,475   May 22,1992","17/18","SORSOGON","05","board member","1ST DISTRICT"," 13,475","May 22,1992","MELLA, FULGENCIO JR. A.","NPC",TRUE
