"","V1","page","province","region","position","district","votes","proclamation_date","name","party","has_nickname"
"389","LABALAN, ANECITO JR. Q.      NONO                             LDP                      13,314   May 22,1992","17/18","SORSOGON","05","board member","1ST DISTRICT"," 13,314","May 22,1992","LABALAN, ANECITO JR. Q.","LDP",TRUE
"390","LANUZA, HONESIMO L.          HONING                           NPC-PP                   12,752   May 22,1992","17/18","SORSOGON","05","board member","1ST DISTRICT"," 12,752","May 22,1992","LANUZA, HONESIMO L.","NPC-PP",TRUE
"391","BASARES, EDGAR C.                                             LDP                      12,612","17/18","SORSOGON","05","board member","1ST DISTRICT"," 12,612",NA,"BASARES, EDGAR C.","",TRUE
"392","LABITAG, ROBERTO T.                                           LP/PDP                   11,612","17/18","SORSOGON","05","board member","1ST DISTRICT"," 11,612",NA,"LABITAG, ROBERTO T.","",TRUE
"393","FERWELO, CONCESO E.                                           LDP                      11,356","17/18","SORSOGON","05","board member","1ST DISTRICT"," 11,356",NA,"FERWELO, CONCESO E.","",TRUE
"394","AJERO, DELFIN L.                                              LAKAS-NUCD               11,248","17/18","SORSOGON","05","board member","1ST DISTRICT"," 11,248",NA,"AJERO, DELFIN L.","",TRUE
"395","DARO, DIONESIO E.                                             NPC                      11,142","17/18","SORSOGON","05","board member","1ST DISTRICT"," 11,142",NA,"DARO, DIONESIO E.","",TRUE
"396","RAMOS, GAUDENCIO T.                                           LDP                      10,713","17/18","SORSOGON","05","board member","1ST DISTRICT"," 10,713",NA,"RAMOS, GAUDENCIO T.","",TRUE
"397","ALIBANTO, MANUEL H.                                           LDP                      10,495","17/18","SORSOGON","05","board member","1ST DISTRICT"," 10,495",NA,"ALIBANTO, MANUEL H.","",TRUE
"398","DAGNALAN, SOCORRO L.                                          -                        10,183","17/18","SORSOGON","05","board member","1ST DISTRICT"," 10,183",NA,"DAGNALAN, SOCORRO L.","-",FALSE
"399","GOJOL, GIL S.                                                 LP/PDP                   8,810","17/18","SORSOGON","05","board member","1ST DISTRICT"," 8,810",NA,"GOJOL, GIL S.","",TRUE
"400","DESPI, ELY D.                                                 LP/PDP                   7,768","17/18","SORSOGON","05","board member","1ST DISTRICT"," 7,768",NA,"DESPI, ELY D.","",TRUE
"401","HIBO, ANTONIO B.                                              LAKAS-NUCD               6,743","17/18","SORSOGON","05","board member","1ST DISTRICT"," 6,743",NA,"HIBO, ANTONIO B.","",TRUE
"402","FRANCISCO, REYNALDO G.                                        LAKAS-NUCD               6,661","17/18","SORSOGON","05","board member","1ST DISTRICT"," 6,661",NA,"FRANCISCO, REYNALDO G.","",TRUE
"403","BARRO, EDUARDO P.                                             LAKAS-NUCD               6,082","17/18","SORSOGON","05","board member","1ST DISTRICT"," 6,082",NA,"BARRO, EDUARDO P.","",TRUE
"404","DIOQUINO, JOSE E.                                             LP/PDP                   5,099","17/18","SORSOGON","05","board member","1ST DISTRICT"," 5,099",NA,"DIOQUINO, JOSE E.","",TRUE
"405","FRIVALDO, EDUARDO T.                                          PRP                      3,711","17/18","SORSOGON","05","board member","1ST DISTRICT"," 3,711",NA,"FRIVALDO, EDUARDO T.","",TRUE
"406","GRAGEDA, LEDA D.                                              LAKAS-NUCD               2,880","17/18","SORSOGON","05","board member","1ST DISTRICT"," 2,880",NA,"GRAGEDA, LEDA D.","",TRUE
"407","LAURINARIA, GILBERT L.                                        NPC                      2,367","17/18","SORSOGON","05","board member","1ST DISTRICT"," 2,367",NA,"LAURINARIA, GILBERT L.","",TRUE
"408","DONOR, TEODULFO E.                                            NP                       2,206","17/18","SORSOGON","05","board member","1ST DISTRICT"," 2,206",NA,"DONOR, TEODULFO E.","",TRUE
"409","CUNANAN, RODOLFO P.                                           KBL                      1,777","17/18","SORSOGON","05","board member","1ST DISTRICT"," 1,777",NA,"CUNANAN, RODOLFO P.","",TRUE
"410","JAYCO, AZARIAS R.                                             NP                       1,234","17/18","SORSOGON","05","board member","1ST DISTRICT"," 1,234",NA,"JAYCO, AZARIAS R.","",TRUE
"411","DELLOSON, PROCOPIO D.                                         LAKAS-NUCD                767","17/18","SORSOGON","05","board member","1ST DISTRICT"," 767",NA,"DELLOSON, PROCOPIO D.","",TRUE
"412","BERDIN, DOMINADOR J                                           KBL                       756","17/18","SORSOGON","05","board member","1ST DISTRICT"," 756",NA,"BERDIN, DOMINADOR J","",TRUE
"413","MANANSALA, EMMA J                                             PRP                       651","17/18","SORSOGON","05","board member","1ST DISTRICT"," 651",NA,"MANANSALA, EMMA J","",TRUE
"414","ESPINEDA, ROLIN G.                                            KBL                       317","17/18","SORSOGON","05","board member","1ST DISTRICT"," 317",NA,"ESPINEDA, ROLIN G.","",TRUE
"415","VALINO, GAVINO B.                                             KBL                       316","17/18","SORSOGON","05","board member","1ST DISTRICT"," 316",NA,"VALINO, GAVINO B.","",TRUE
"416","NOGALES, HENRY D.                                             KBL                       240","17/18","SORSOGON","05","board member","1ST DISTRICT"," 240",NA,"NOGALES, HENRY D.","",TRUE
"417","DERI, OSCAR G.               OCA                               LDP                      20,932   May 22,1992","18/18","SORSOGON","05","board member","1ST DISTRICT"," 20,932","May 22,1992","DERI, OSCAR G.","LDP",TRUE
"418","DUGAN, BEN-HUR E.            CVC                               LAKAS-NUCD               18,255   May 22,1992","18/18","SORSOGON","05","board member","1ST DISTRICT"," 18,255","May 22,1992","DUGAN, BEN-HUR E.","LAKAS-NUCD",TRUE
"419","VILLAREAL, RAFAEL E.                                           LDP                      18,190   May 22,1992","18/18","SORSOGON","05","board member","1ST DISTRICT"," 18,190","May 22,1992","VILLAREAL, RAFAEL E.","",TRUE
"420","DIESTA, ANTONIO F.           CINCO MO                          LDP                      16,880   May 22,1992","18/18","SORSOGON","05","board member","1ST DISTRICT"," 16,880","May 22,1992","DIESTA, ANTONIO F.","LDP",TRUE
"421","BURGOS, ANDRE SY             ANDRE                             LAKAS-NUCD               15,908   May 22,1992","18/18","SORSOGON","05","board member","1ST DISTRICT"," 15,908","May 22,1992","BURGOS, ANDRE SY","LAKAS-NUCD",TRUE
"422","ENCINAS, ANTONIO D.                                            NPC                      15,630","18/18","SORSOGON","05","board member","1ST DISTRICT"," 15,630",NA,"ENCINAS, ANTONIO D.","",TRUE
"423","DELMONTE, ENRIQUE G.                                           LAKAS-NUCD               14,353","18/18","SORSOGON","05","board member","1ST DISTRICT"," 14,353",NA,"DELMONTE, ENRIQUE G.","",TRUE
"424","GALIAS, MODESTO JR. R.                                         LAKAS-NUCD               11,841","18/18","SORSOGON","05","board member","1ST DISTRICT"," 11,841",NA,"GALIAS, MODESTO JR. R.","",TRUE
"425","TUBIANOSA, IBARRA R.                                           LDP                      11,731","18/18","SORSOGON","05","board member","1ST DISTRICT"," 11,731",NA,"TUBIANOSA, IBARRA R.","",TRUE
"426","CHAVEZ, JULIAN O.                                              LP/PDP                   11,076","18/18","SORSOGON","05","board member","1ST DISTRICT"," 11,076",NA,"CHAVEZ, JULIAN O.","",TRUE
"427","DE VERA, ANTONIO E.                                            LDP                      10,455","18/18","SORSOGON","05","board member","1ST DISTRICT"," 10,455",NA,"DE VERA, ANTONIO E.","",TRUE
"428","BISCO, RODOLFO E.                                              NPC                      9,519","18/18","SORSOGON","05","board member","1ST DISTRICT"," 9,519",NA,"BISCO, RODOLFO E.","",TRUE
"429","BUENVIAJE, SOCORRO B.                                          LAKAS-NUCD               8,710","18/18","SORSOGON","05","board member","1ST DISTRICT"," 8,710",NA,"BUENVIAJE, SOCORRO B.","",TRUE
"430","ORENSE, ANTONIO S.                                             NPC                      7,646","18/18","SORSOGON","05","board member","1ST DISTRICT"," 7,646",NA,"ORENSE, ANTONIO S.","",TRUE
"431","LOPEZ, ISMAEL L.                                               LDP                      7,039","18/18","SORSOGON","05","board member","1ST DISTRICT"," 7,039",NA,"LOPEZ, ISMAEL L.","",TRUE
"432","FELLONE, SANTIAGO E.                                           LP/PDP                   5,762","18/18","SORSOGON","05","board member","1ST DISTRICT"," 5,762",NA,"FELLONE, SANTIAGO E.","",TRUE
"433","FULLEROS, LOLITO C.                                            LP/PDP                   5,696","18/18","SORSOGON","05","board member","1ST DISTRICT"," 5,696",NA,"FULLEROS, LOLITO C.","",TRUE
"434","DE ORTUBE, FEDERICO S.                                         LP/PDP                   3,503","18/18","SORSOGON","05","board member","1ST DISTRICT"," 3,503",NA,"DE ORTUBE, FEDERICO S.","",TRUE
"435","GUDA, RUFINO JR. S.                                            LP/PDP                   3,266","18/18","SORSOGON","05","board member","1ST DISTRICT"," 3,266",NA,"GUDA, RUFINO JR. S.","",TRUE
"436","GUEVARA, ALFREDO A.                                            NP                       2,506","18/18","SORSOGON","05","board member","1ST DISTRICT"," 2,506",NA,"GUEVARA, ALFREDO A.","",TRUE
"437","RAMOS, SAMSON G.                                               INDEPENDENT               882","18/18","SORSOGON","05","board member","1ST DISTRICT"," 882",NA,"RAMOS, SAMSON G.","",TRUE
"438","MUYOT, ROMULO F.                                               KBL                       594","18/18","SORSOGON","05","board member","1ST DISTRICT"," 594",NA,"MUYOT, ROMULO F.","",TRUE
"439","GALLANOSA, MARIA CORAZON G.                                    KBL                       319","18/18","SORSOGON","05","board member","1ST DISTRICT"," 319",NA,"GALLANOSA, MARIA CORAZON G.","",TRUE
